{
  "site": {
    "name": "canso"
  },
  "corridor": {
    "A_min_deg": 100.0,
    "A_max_deg": 140.0
  },
  "criteria_version": "v1",
  "vehicle_profile_id": "cyclone4m",
  "row_flags": {
    "corridor_A_min_deg": "ASSUMPTION",
    "corridor_A_max_deg": "ASSUMPTION"
  },
  "source_files": [
    "backend/engine/data/site_canso.json",
    "backend/weather/data/criteria_v1.json"
  ]
}
